{
  "id": "openrouter-free-route-data-policy",
  "schema_version": "1.0.0",
  "claim": "OpenRouter official docs (fetched 2026-07-04): OpenRouter does not store prompts/responses by default; prompt retention is opt-in, while request metadata is stored. Provider-level logging/training is separate: OpenRouter reflects provider data policies per endpoint and gives users deny controls for providers that may collect or train, with separate account settings for paid vs free models. Zero Data Retention (ZDR) is enforceable globally, per model group, and per request; an unknown provider policy is conservatively treated as retain-and-train. For qwen/qwen3-coder:free and nvidia/nemotron-3-ultra-550b-a55b:free the official model pages/API confirm free price, model slugs, and metadata, but the fetched pages/API exposed no per-endpoint data-policy tag, so the specific prompt-logging/retention/training status of those exact endpoints is UNVERIFIED from accessible official text. Free-tier rate limits: the official limits page states :free variants have per-minute and per-day limits, but the fetched text omitted the numeric values; the commonly cited 20 RPM and 50 requests/day without $10 purchased credits (1000/day with $10+) are UNVERIFIED from fetched official text, and whether failed attempts count into the quota is UNVERIFIED. If an account-level privacy setting denies free-model data collection/training, routes that do not match the privacy settings ERROR rather than complete.",
  "claim_kind": "source",
  "source": "https://openrouter.ai/docs/guides/privacy/data-collection; https://openrouter.ai/docs/guides/privacy/provider-logging; https://openrouter.ai/docs/guides/features/zdr; https://openrouter.ai/docs/guides/routing/provider-selection; https://openrouter.ai/docs/api/reference/limits; https://openrouter.ai/qwen/qwen3-coder%3Afree; https://openrouter.ai/nvidia/nemotron-3-ultra-550b-a55b%3Afree; https://openrouter.ai/api/v1/models (all accessed 2026-07-04)",
  "source_date": "2026-07-04",
  "freshness_ttl_days": 90,
  "covered_claim": "Stage-1 precondition of docs/decisions/openrouter-free-lane-adr.md: per-provider data-policy/ZDR verification is recorded as dated evidence before the OpenRouter free worker-lane client is implemented.",
  "fallback": "Re-fetch the official OpenRouter data-collection, provider-logging, ZDR, provider-selection, and limits docs plus /api/v1/key before stage-1 activation; until per-endpoint policy tags are verified, treat both :free endpoints conservatively as retain-and-train and enforce ZDR/provider-deny controls per request.",
  "notes": "Claimed via the control-plane evidence claim block in product-design-os/library/source-catalog.json because the evidence claimant whitelist covers only PDOS artifacts; the real dependent artifact is docs/decisions/openrouter-free-lane-adr.md. The ADR's 50/day + 20 rpm budget stands as an owner-verified decision; this record only states that those numbers were not reproducible from fetched official text on 2026-07-04."
}
